{
  "contract_version": "1.0.0",
  "kind": "evaluation_release_report",
  "report_id": "eval-riverside-editor-2026-08-05",
  "release_id": "riverside-editor-2026-08-05",
  "release_version": "1.0.0",
  "baseline_release_id": "riverside-editor-2026-07-15",
  "generated_at": "2026-08-05T11:55:00Z",
  "source_commit": "0123456789abcdef0123456789abcdef01234567",
  "decision": "promote",
  "decision_reasons": [
    "All required domain thresholds passed on the named datasets and slices."
  ],
  "evidence": [
    {
      "name": "offline-evaluation-results",
      "uri": "repo://evaluations/evidence/offline-results.json",
      "digest": {
        "algorithm": "sha256",
        "value": "eeeeeeeeeeeeeeeeeeeeeeeeeeeeeeeeeeeeeeeeeeeeeeeeeeeeeeeeeeeeeeee"
      }
    }
  ],
  "domains": {
    "data_quality": [
      {
        "metric_id": "required_field_completeness",
        "dataset": {
          "id": "riverside-manuscripts",
          "version": "2026-08-05"
        },
        "evaluator": {
          "id": "data-quality-gates",
          "version": "1.0.0"
        },
        "slice": {
          "name": "format",
          "value": "text"
        },
        "threshold": {
          "operator": "gte",
          "value": 0.99,
          "unit": "ratio"
        },
        "observed": {
          "value": 1.0,
          "unit": "ratio"
        },
        "status": "pass"
      }
    ],
    "retrieval_quality": [
      {
        "metric_id": "recall_at_6",
        "dataset": {
          "id": "riverside-retrieval-queries",
          "version": "1.0"
        },
        "evaluator": {
          "id": "retrieval-gates",
          "version": "1.0.0"
        },
        "slice": {
          "name": "query_type",
          "value": "all"
        },
        "threshold": {
          "operator": "gte",
          "value": 0.8,
          "unit": "ratio"
        },
        "observed": {
          "value": 0.88,
          "unit": "ratio"
        },
        "uncertainty": {
          "method": "bootstrap",
          "lower": 0.83,
          "upper": 0.92,
          "confidence_level": 0.95,
          "sample_size": 200
        },
        "status": "pass"
      }
    ],
    "generation_citation_quality": [
      {
        "metric_id": "citation_correctness",
        "dataset": {
          "id": "riverside-grounded-generation",
          "version": "1.0"
        },
        "evaluator": {
          "id": "citation-gates",
          "version": "1.0.0"
        },
        "slice": {
          "name": "query_type",
          "value": "all"
        },
        "threshold": {
          "operator": "gte",
          "value": 0.9,
          "unit": "ratio"
        },
        "observed": {
          "value": 0.94,
          "unit": "ratio"
        },
        "status": "pass"
      }
    ],
    "adaptation_evidence": [
      {
        "metric_id": "heldout_positive_edge_rate",
        "dataset": {
          "id": "dpo-heldout-pairs",
          "version": "2026-08-05"
        },
        "evaluator": {
          "id": "adaptation-gates",
          "version": "1.0.0"
        },
        "slice": {
          "name": "task",
          "value": "scene_advancement"
        },
        "threshold": {
          "operator": "gte",
          "value": 0.75,
          "unit": "ratio"
        },
        "observed": {
          "value": 1.0,
          "unit": "ratio"
        },
        "status": "pass"
      }
    ],
    "safety_authorization": [
      {
        "metric_id": "acl_leakage_rate",
        "dataset": {
          "id": "authorization-adversarial",
          "version": "1.0"
        },
        "evaluator": {
          "id": "authorization-gates",
          "version": "1.0.0"
        },
        "slice": {
          "name": "tenant_tier",
          "value": "standard"
        },
        "threshold": {
          "operator": "eq",
          "value": 0,
          "unit": "count"
        },
        "observed": {
          "value": 0,
          "unit": "count"
        },
        "status": "pass"
      }
    ],
    "operational_slos": [
      {
        "metric_id": "p95_total_latency",
        "dataset": {
          "id": "staging-bounded-load",
          "version": "2026-08-05"
        },
        "evaluator": {
          "id": "operational-gates",
          "version": "1.0.0"
        },
        "slice": {
          "name": "load_stage",
          "value": "bounded"
        },
        "threshold": {
          "operator": "lte",
          "value": 2.0,
          "unit": "seconds"
        },
        "observed": {
          "value": 1.7,
          "unit": "seconds"
        },
        "status": "pass"
      }
    ],
    "cost": [
      {
        "metric_id": "cost_per_successful_request",
        "dataset": {
          "id": "staging-cost-model",
          "version": "2026-08-05"
        },
        "evaluator": {
          "id": "cost-gates",
          "version": "1.0.0"
        },
        "slice": {
          "name": "tenant_tier",
          "value": "standard"
        },
        "threshold": {
          "operator": "lte",
          "value": 0.05,
          "unit": "usd_per_request"
        },
        "observed": {
          "value": 0.04,
          "unit": "usd_per_request"
        },
        "status": "pass"
      }
    ],
    "rollout_comparison": [
      {
        "metric_id": "candidate_success_rate_delta",
        "dataset": {
          "id": "shadow-traffic-summary",
          "version": "2026-08-05"
        },
        "evaluator": {
          "id": "rollout-gates",
          "version": "1.0.0"
        },
        "slice": {
          "name": "deployment_slot",
          "value": "green"
        },
        "threshold": {
          "operator": "gte",
          "value": 0,
          "unit": "percentage_points"
        },
        "observed": {
          "value": 1.5,
          "unit": "percentage_points"
        },
        "status": "pass"
      }
    ]
  }
}
